Pham Huu Tiep,Rutgers University,https://scholar.google.com/citations?view_op=view_org&hl=en&org=3903766639137847059,Verified email at math.rutgers.edu - Homepage,https://sites.math.rutgers.edu/~pht19/,4247,1933,36,21,112,73,AlgebraGroup TheoryRepresentation Theory,https://scholar.google.com/citations?hl=en&user=35RkcIYAAAAJ
Matthew Lai,DeepMind,,Verified email at google.com,,20735,18697,10,10,10,10,Machine LearningDeep LearningComputer Vision,https://scholar.google.com/citations?hl=en&user=0XbdYEYAAAAJ
Giang Nguyen,"Assoc. Prof., FIIT STU",,Verified email at stuba.sk - Homepage,https://giangzuzana.github.io/,1814,1481,17,13,29,19,Machine Learning Deep Learning Applied Soft Computing Privacy and Security IT/HPC/PDC,https://scholar.google.com/citations?hl=en&user=IEmgzZkAAAAJ
Quang Duy La,"Research Fellow, Singapore University of Technology and Design (SUTD)",,Verified email at ntu.edu.sg,,2211,1849,14,11,17,11,Game theoryMachine learningoptimization,https://scholar.google.com/citations?hl=en&user=KNvnHIkAAAAJ
Trung Quy Phan,"PhD Candidate, National University of Singapore",https://scholar.google.com/citations?view_op=view_org&hl=en&org=83442941566286721,Verified email at comp.nus.edu.sg,,2134,829,19,13,24,16,Computer Vision,https://scholar.google.com/citations?hl=en&user=wAGVhRkAAAAJ
Duc Thanh Nguyen,"Senior Lecturer, Deakin University",https://scholar.google.com/citations?view_op=view_org&hl=en&org=10412436667236230217,Verified email at deakin.edu.au - Homepage,http://ducthanhnguyen.weebly.com/,4043,3383,26,21,44,35,Computer VisionPattern RecognitionImage Processing,https://scholar.google.com/citations?hl=en&user=4vExyv8AAAAJ
Thanh Nguyen-Duc,"PhD, Data Science and AI",,Verified email at monash.edu - Homepage,https://www.linkedin.com/in/thanh-nguyen-cse/,758,719,6,6,4,4,Machine LearningDeep LearningMedical Imaging,https://scholar.google.com/citations?hl=en&user=i5ByiVcAAAAJ
Thanh Duc Nguyen,"Ph.D., Montreal Neurological Institute, McGill University, Canada",https://scholar.google.com/citations?view_op=view_org&hl=en&org=13784427342582529234,Verified email at mail.mcgill.ca - Homepage,https://www.researchgate.net/profile/Duc_Nguyen109,525,517,9,9,9,9,Artificial intelligentComputer visionDeep learningMedical Image AnalysisDigital Pathology,https://scholar.google.com/citations?hl=en&user=SMN8RbYAAAAJ
DH Phong,"Professor of Mathematics, Columbia University",https://scholar.google.com/citations?view_op=view_org&hl=en&org=8867661471528740601,Verified email at math.columbia.edu - Homepage,http://www.math.columbia.edu/~phong/,9936,2649,58,30,128,80,partial differential equationscomplex geometrymathematical physics,https://scholar.google.com/citations?hl=en&user=0qH_YvoAAAAJ
Thang D Bui,"Lecturer, Australian National University",https://scholar.google.com/citations?view_op=view_org&hl=en&org=2250428170388210728,Verified email at anu.edu.au - Homepage,http://thangbui.github.io/,2269,1972,16,15,19,17,Machine LearningBayesian StatisticsArtificial Intelligence,https://scholar.google.com/citations?hl=en&user=SVq3y1sAAAAJ
Dzung Hoang,"Apple, Inc.",,Verified email at alumni.brown.edu,,1248,145,19,7,28,3,video compressionsignal processing,https://scholar.google.com/citations?hl=en&user=cxBJ9bcAAAAJ
Chinh T. Hoang,"Professor of Computer Science, Wilfrid Laurier University",https://scholar.google.com/citations?view_op=view_org&hl=en&org=7103833495479198054,Verified email at wlu.ca,,2740,879,28,17,61,26,graph theorygraph algorithmstheoretical computer science,https://scholar.google.com/citations?hl=en&user=fO9txcMAAAAJ
Dung-Hai Lee,U.C.Berkeley,https://scholar.google.com/citations?view_op=view_org&hl=en&org=11816294095661060495,Verified email at berkeley.edu,,26223,6894,79,44,174,117,condensed matter theory,https://scholar.google.com/citations?hl=en&user=uN5DILEAAAAJ
Andrew A. Chien,"William Eckhardt Distinguished Service Professor of Computer Science, University of Chicago",https://scholar.google.com/citations?view_op=view_org&hl=en&org=16671384941190438141,Verified email at cs.uchicago.edu - Homepage,http://achien.cs.uchicago.edu/,16661,2554,64,23,192,49,computer architecturehigh-performance computingcloudssustainabilitydata-intensive,https://scholar.google.com/citations?hl=en&user=zkqz0_0AAAAJ
Nguyen Trung Hieu,Alibaba Cloud Singapore Pte Ltd,,Verified email at alibaba-inc.com,,20898,3441,15,11,21,13,Speech Processing,https://scholar.google.com/citations?hl=en&user=RA5lzN8AAAAJ
Nhat Ho,"Professor at University of Texas, Austin",https://scholar.google.com/citations?view_op=view_org&hl=en&org=14823011757688503605,Verified email at utexas.edu - Homepage,https://nhatptnk8912.github.io/,2338,2288,26,26,57,56,Machine LearningBayesian StatisticsOptimizationOptimal TransportDeep Learning,https://scholar.google.com/citations?hl=en&user=Xs7cKMwAAAAJ
ThanhVu (Vu) Nguyen,"Computer Science, George Mason University",https://scholar.google.com/citations?view_op=view_org&hl=en&org=11304740246128990681,Verified email at gmu.edu - Homepage,https://dynaroars.github.io/,3994,2031,17,16,27,19,Software EngineeringFormal MethodsSoftware Testing and VerificationAI Safety,https://scholar.google.com/citations?hl=en&user=TLcVQ-MAAAAJ
My T. Thai,"Professor, University of Florida, IEEE Fellow",https://scholar.google.com/citations?view_op=view_org&hl=en&org=5315230152465104173,Verified email at cise.ufl.edu - Homepage,http://www.cise.ufl.edu/~mythai,11526,5673,54,41,155,109,Explainable AISecurity and PrivacyNetwork ScienceOptimization,https://scholar.google.com/citations?hl=en&user=zLLJimcAAAAJ
Song Han,Massachusetts Institute of Technology,https://scholar.google.com/citations?view_op=view_org&hl=en&org=16345133980181568013,Verified email at mit.edu - Homepage,http://songhan.mit.edu/,61241,55753,62,62,119,118,Computer ArchitectureDeep LearningComputer Vision,https://scholar.google.com/citations?hl=en&user=E0iCaa4AAAAJ
Cong Duy Vu Hoang,Applied Scientist at Oracle Corp.,https://scholar.google.com/citations?view_op=view_org&hl=en&org=4070388776040915118,Verified email at oracle.com - Homepage,https://duyvuleo.github.io/,1077,791,11,11,11,11,Applied DL/ML/NLP/NLU/GenAI,https://scholar.google.com/citations?hl=en&user=UFN7fXQAAAAJ
Huy V. Vo,Researcher at Meta FAIR,,Verified email at meta.com - Homepage,https://huyvvo.github.io/,2123,2122,9,9,9,9,Compute visionmachine learning,https://scholar.google.com/citations?hl=en&user=gIf5VqUAAAAJ