Name,Affiliation ,Affiliation Link,Email,Verified Email Link,Citations (Total),Citations (Since 2019),h-index (Total),h-index (Since 2019) ,i10-index (Total),i10-index (Since 2019) ,Interest ,Google Scholar Link
Kiet A. Nguyen,Air Force Research Laboratory,,Verified email at afresearchlab.com,,29483,5486,45,17,73,31,deep learningquantum chemistrytwo-photon absorption,https://scholar.google.com/citations?hl=en&user=vH-BXOsAAAAJ
Harold Nguyen,Apple,https://scholar.google.com/citations?view_op=view_org&hl=en&org=11540454294127154050,Verified email at apple.com,,27986,2925,92,28,199,70,deep learningreinforcement learning,https://scholar.google.com/citations?hl=en&user=20lb9OAAAAAJ
Russell Nguyen,"Ph.D, Soongil University",,Verified email at ssu.ac.kr - Homepage,https://sites.google.com/site/vspnta/,48752,30036,92,69,813,643,Image denoisingImage enhancement,https://scholar.google.com/citations?hl=en&user=x5foNkQAAAAJ
Truong Nguyen,UCSD,https://scholar.google.com/citations?view_op=view_org&hl=en&org=7549334305653538480,Verified email at eng.ucsd.edu - Homepage,http://videoprocessing.ucsd.edu/,33913,9784,74,40,394,160,Video ProcessingImage ProcessingWaveletsFilter Banks,https://scholar.google.com/citations?hl=en&user=5rjfy4AAAAAJ
Le Lu,"Alibaba DAMO Academy, IEEE Fellow, MICCAI Board Member (2021-2024)",,Verified email at alibaba-inc.com - Homepage,http://lelu007.github.io/,28581,24906,64,55,161,141,Computer VisionMedical Image AnalysisMedical Image ComputingBiomedical Image Analysis,https://scholar.google.com/citations?hl=en&user=kZn0f6gAAAAJ
Long Bao Le,"INRS, University of Quebec",https://scholar.google.com/citations?view_op=view_org&hl=en&org=15886531677170443712,Verified email at emt.inrs.ca - Homepage,https://longbaole.github.io/,14105,7542,58,40,174,118,Wireless communicationswireless networkingcloud/edge computingsmart grids,https://scholar.google.com/citations?hl=en&user=-STl68rkz_kC
Hung Q. Ngo,RelationalAI,,Verified email at relational.ai - Homepage,http://hung-q-ngo.github.io/,4880,2473,36,26,77,45,Query OptimizationDeclarative computations,https://scholar.google.com/citations?hl=en&user=srP2ANoAAAAJ
Quan Vuong,Physical Intelligence,,Verified email at ucsd.edu - Homepage,https://quanvuong.github.io/,3541,3539,19,19,27,27,Reinforcement LearningComputer Vision,https://scholar.google.com/citations?hl=en&user=NSWI3OwAAAAJ
Trac D. Tran,"Prosessor of Electrical and Computer Engineering, Johns Hopkins University",https://scholar.google.com/citations?view_op=view_org&hl=en&org=12129954330541958834,Verified email at jhu.edu - Homepage,http://thanglong.ece.jhu.edu/,13880,5491,55,36,201,105,Electrical and Computer EngineeringMathComputer Science,https://scholar.google.com/citations?hl=en&user=RyRjA0cAAAAJ
Brandon Tran,"Ph.D, MIT",https://scholar.google.com/citations?view_op=view_org&hl=en&org=16345133980181568013,Verified email at mit.edu,,4415,4353,14,13,14,14,Computer Science,https://scholar.google.com/citations?hl=en&user=aUeGl58AAAAJ
Tran Cao Son,"Professor of Computer Science, New Mexico State University",https://scholar.google.com/citations?view_op=view_org&hl=en&org=11761345890736700625,Verified email at nmsu.edu - Homepage,http://www.cs.nmsu.edu/~tson,8510,1604,35,19,123,46,Artificial IntelligenceLogic ProgrammingIntelligent AgentPlanning,https://scholar.google.com/citations?hl=en&user=7jKj_NcAAAAJ
Truyen Tran,"Professor | Head of AI, Health and Science @ Deakin University",https://scholar.google.com/citations?view_op=view_org&hl=en&org=10412436667236230217,Verified email at deakin.edu.au - Homepage,http://truyentran.github.io/,8369,6992,42,37,102,82,artificial intelligenceAI for healthAI for science,https://scholar.google.com/citations?hl=en&user=zvspVLwAAAAJ
Minh-Thang Luong,Senior Staff Research Scientist at Google,https://scholar.google.com/citations?view_op=view_org&hl=en&org=6518679690484165796,Verified email at google.com - Homepage,http://www.thangluong.com/,36572,31638,48,43,55,53,Deep LearningNatural Language Processing,https://scholar.google.com/citations?hl=en&user=Bmbkv6sAAAAJ
QT Luong,independent researcher,,Verified email at terragalleria.com - Homepage,http://www.terragalleria.com/,10969,1160,33,13,46,15,,https://scholar.google.com/citations?hl=en&user=EdjwXCkAAAAJ
Minh Q. Phan,Dartmouth College,https://scholar.google.com/citations?view_op=view_org&hl=en&org=18229439179148490080,Verified email at dartmouth.edu,,4751,937,34,14,90,21,system identificationiterative learning controlmodel predictive control,https://scholar.google.com/citations?hl=en&user=iDeeQJsAAAAJ
Le Trieu Phong,"NICT, Japan",https://scholar.google.com/citations?view_op=view_org&hl=en&org=6714448588867201825,Verified email at nict.go.jp,,2581,2301,15,12,23,14,CryptographyPrivacy-Preseving Techniques,https://scholar.google.com/citations?hl=en&user=n31F97QAAAAJ
Ni Trieu,Arizona State University,https://scholar.google.com/citations?view_op=view_org&hl=en&org=856495938334247183,Verified email at asu.edu - Homepage,https://nitrieu.github.io/,1913,1828,16,15,20,19,cryptography,https://scholar.google.com/citations?hl=en&user=AZgugwsAAAAJ
Tony Pham,"Assistant Professor of Instruction, University of South Florida",https://scholar.google.com/citations?view_op=view_org&hl=en&org=14060067174649929731,Verified email at usf.edu,,9553,6627,46,38,97,92,Modeling of Metal–Organic Materials,https://scholar.google.com/citations?hl=en&user=bI599PAAAAAJ
Pham Dinh Tao,"Professor Emeritus of Applied Mathematics, Laboratory of Mathematics, INSA-Rouen, Normandie, 76801",https://scholar.google.com/citations?view_op=view_org&hl=en&org=11757796089323842028,Verified email at insa-rouen.fr,,8572,3269,39,21,111,52,Numerical AnalysisMathematical OptimizationDC Programming & DCAOperations Research,https://scholar.google.com/citations?hl=en&user=9IGkmdgAAAAJ
Tuan D. Pham,"Barts and The London School of Medicine and Dentistry, Queen Mary University of London",https://scholar.google.com/citations?view_op=view_org&hl=en&org=11628095156398365105,Verified email at qmul.ac.uk - Homepage,https://sites.google.com/view/tuan-d-pham/home,7861,4203,42,31,148,84,AIImagingSignalsDiagnosticsTrauma,https://scholar.google.com/citations?hl=en&user=dvPaFIkAAAAJ
Nhat Trung Doan,University of Oslo,https://scholar.google.com/citations?view_op=view_org&hl=en&org=4617098211100467394,Verified email at medisin.uio.no - Homepage,http://www.med.uio.no/klinmed/english/people/aca/nhattd/index.html,9438,8506,43,42,62,58,machine learningimaging geneticsdeep learning,https://scholar.google.com/citations?hl=en&user=H2whtRcAAAAJ
Minh Doan,"M.D., Ph.D., Head of Bioimaging Analytics, GlaxoSmithKline",,Verified email at broadinstitute.org,,3499,3335,19,18,24,22,MedicineBioimagingMachine learningData analyticsIntegrative multi-omics,https://scholar.google.com/citations?hl=en&user=M6_hL-AAAAAJ
Doan Hoang,"Professor, University of Technology Sydney",https://scholar.google.com/citations?view_op=view_org&hl=en&org=10906564628192137533,Verified email at uts.edu.au - Homepage,https://profiles.uts.edu.au/Doan.Hoang,3056,1192,25,17,70,26,Software Defined Infrastructures: NetworksIoTs and Clouds)CybersecurityDeep Learningand Assistive Healthcare,https://scholar.google.com/citations?hl=en&user=sJa3rikAAAAJ
Son Doan,Kaiser Permanente,https://scholar.google.com/citations?view_op=view_org&hl=en&org=3575131596673458003,Verified email at kp.org,,2474,1013,21,15,33,22,Natural Language ProcessingArtificial IntelligenceBiomedical Informatics,https://scholar.google.com/citations?hl=en&user=zIJaWPEAAAAJ
Bao Gia Doan,"Postdoctoral Research Fellow, University of Adelaide",https://scholar.google.com/citations?view_op=view_org&hl=en&org=9499157965008867783,Verified email at adelaide.edu.au - Homepage,https://researchers.adelaide.edu.au/profile/giabao.doan,680,679,5,5,5,5,Machine Learning SecurityDeep Learning RobustnessArtificial IntelligenceSecurity,https://scholar.google.com/citations?hl=en&user=IKf830cAAAAJ
Nicola Bui,"SR Research Engineer, Bastille",,Verified email at bastille.io,,11114,6649,24,17,47,25,LTESecurity,https://scholar.google.com/citations?hl=en&user=OnWzYPIAAAAJ
Hung Bui,"Research Scientist, Google DeepMind",https://scholar.google.com/citations?view_op=view_org&hl=en&org=6518679690484165796,Verified email at google.com - Homepage,https://sites.google.com/site/buihhung/,8326,3985,42,29,102,62,Artificial IntelligenceProbabilistic InferenceMachine Learning...,https://scholar.google.com/citations?hl=en&user=mDLwSZAAAAAJ
Ha H. Bui,"Professor of Civil Engineering, ARC Future Fellow, Monash University",https://scholar.google.com/citations?view_op=view_org&hl=en&org=3918598370877205258,Verified email at monash.edu - Homepage,https://www.monash.edu/engineering/hahbui,5894,4646,40,39,89,79,Computational geomechanicsConstitutive modellingGeomechanicsParticle methodsSPH,https://scholar.google.com/citations?hl=en&user=MBYnTHEAAAAJ
Tien Dai Bui,"Professor of Computer Science, Concordia University",,No verified email - Homepage,https://users.encs.concordia.ca/~bui/,5570,1233,37,21,98,32,Computer visionmachine learningimage processing,https://scholar.google.com/citations?hl=en&user=MwRghikAAAAJ
Trung H. Bui,"Senior Research Scientist & Research Manager, Adobe Research",,Verified email at adobe.com - Homepage,http://sites.google.com/site/trungbuistanford,4315,3835,31,29,84,74,DialogNatural Language ProcessingMachine Learning,https://scholar.google.com/citations?hl=en&user=FpFTduYAAAAJ
Tan Bui-Thanh,Associate Professor. The Department of Aerospace Engineering and Engineering Mechanics,,Verified email at oden.utexas.edu - Homepage,https://users.oden.utexas.edu/~tanbui/,4260,2359,29,24,50,43,Scientific Deep LearningComputational Mathinverse problemsand uncertainty quantification,https://scholar.google.com/citations?hl=en&user=Eq2PgAIAAAAJ
Vo V. Anh,"Emeritus Professor, Queensland University of Technology, GPO Box 2434, Brisbane, Qld 4001, Australia",https://scholar.google.com/citations?view_op=view_org&hl=en&org=4361879795951977785,Verified email at qut.edu.au - Homepage,https://www.qut.edu.au/about/our-people/academic-profiles/v.anh,16466,6116,65,38,230,119,stochastic analysisstochastic modellingcomputational mathematics,https://scholar.google.com/citations?hl=en&user=xJ4yHgsAAAAJ
Ba Tuong Vo,Curtin University,https://scholar.google.com/citations?view_op=view_org&hl=en&org=12204274328548754159,Verified email at curtin.edu.au - Homepage,http://ba-tuong.vo-au.com/,15402,7793,49,39,95,69,Bayesian EstimationRandom SetsTarget Tracking,https://scholar.google.com/citations?hl=en&user=GkFrtg4AAAAJ
Trung Q. Duong,"Canada Excellence Research Chair at Memorial University, adjunct Prof. at Queen's University Belfast",https://scholar.google.com/citations?view_op=view_org&hl=en&org=17452456186544668394,Verified email at mun.ca - Homepage,https://sites.google.com/site/trungqduong/,20715,13542,78,62,323,253,Quantum Machine LearningQuantum ComputingQuantum CommunicationsReal-time Optimization6G,https://scholar.google.com/citations?hl=en&user=PwsDdmEAAAAJ
Thanh N. Truong,University of Utah,https://scholar.google.com/citations?view_op=view_org&hl=en&org=10124793133719145342,Verified email at utah.edu - Homepage,http://chem.utah.edu/directory/truong/index.php,12642,2199,62,21,162,56,computational chemistrycyberinfrasture,https://scholar.google.com/citations?hl=en&user=Xcq6GlgAAAAJ
Luu Anh Tuan,"Assistant Professor, Nanyang Technological University, Singapore",https://scholar.google.com/citations?view_op=view_org&hl=en&org=3012140508424117850,Verified email at ntu.edu.sg - Homepage,https://tuanluu.github.io/,7022,6602,38,33,71,69,AINLPLarge Language ModelRobustness & TrustworthyInformation Extraction & Semantics,https://scholar.google.com/citations?hl=en&user=d6ixOGYAAAAJ
Loi Luu,Cofounder at Kyber Network,,Verified email at kyber.network - Homepage,https://loiluu.com/,5303,4544,9,9,9,9,CryptocurrencyDistributed Consensus AlgorithmsApplied Cryptography,https://scholar.google.com/citations?hl=en&user=Z2gOqyMAAAAJ
Khoa Luu,"Assistant Professor, EECS, University of Arkansas",https://scholar.google.com/citations?view_op=view_org&hl=en&org=9242586794943470633,Verified email at uark.edu - Homepage,http://csce.uark.edu/~khoaluu/,4566,3507,36,32,76,65,Smart HealthBiometricsAutonomous DrivingQuantum Machine LearningPrecision Agriculture,https://scholar.google.com/citations?hl=en&user=JPAl8-gAAAAJ
Thien Huynh-The,"Senior Member IEEE, Ho Chi Minh City University of Technology and Education",,Verified email at hcmute.edu.vn - Homepage,https://sites.google.com/site/thienhuynhthe/home,5909,5762,38,36,71,69,Signal processingImage processingComputer VisionWireless communicationsDeep learning,https://scholar.google.com/citations?hl=en&user=_MLGtqEAAAAJ
Tien Huynh,IBM Thomas J. Watson Research Center,,Verified email at us.ibm.com,,9345,4110,35,26,70,47,,https://scholar.google.com/citations?hl=en&user=iCOwqmoAAAAJ
Vân Anh Huynh-Thu,University of Liège,,Verified email at uliege.be - Homepage,http://www.montefiore.ulg.ac.be/~huynh-thu,8822,6867,18,17,22,18,Machine learningBioinformatics,https://scholar.google.com/citations?hl=en&user=xBr1MFQAAAAJ
Long Mai,Research Scientist,,Verified email at adobe.com - Homepage,http://mai-t-long.com/,4496,4063,25,23,28,28,Computer VisionComputational PhotographyMachine Learning,https://scholar.google.com/citations?hl=en&user=QHCY1cgAAAAJ
Hoang Pham,Rutgers University,https://scholar.google.com/citations?view_op=view_org&hl=en&org=3903766639137847059,Verified email at soe.rutgers.edu - Homepage,https://ise.rutgers.edu/hoang-pham,17873,7017,63,43,203,138,Reliability engineeringSoftware reliabilityreliability modelingmaintenance,https://scholar.google.com/citations?hl=en&user=PJXcWGAAAAAJ
Thai Son Hoang,"Associate Professor, University of Southampton",https://scholar.google.com/citations?view_op=view_org&hl=en&org=1346287526782559840,Verified email at soton.ac.uk - Homepage,https://www.southampton.ac.uk/people/5xfl2w/doctor-son-hoang,2145,941,21,14,39,22,Software EngineeringFormal Methods,https://scholar.google.com/citations?hl=en&user=mDYOIacAAAAJ
Thai Le,"Assistant Professor in Computer Science, Indiana University",https://scholar.google.com/citations?view_op=view_org&hl=en&org=18243465982490009522,Verified email at iu.edu - Homepage,https://lethaiq.github.io/tql3/,1493,1468,18,18,24,24,Machine learning & AI,https://scholar.google.com/citations?hl=en&user=Fd8K7kAAAAAJ
Dinh Phung,"Professor, Monash University",https://scholar.google.com/citations?view_op=view_org&hl=en&org=3918598370877205258,Verified email at monash.edu - Homepage,http://dinhphung.ml/,14412,9844,51,40,207,140,machine learningdeep learningoptimal transportprobabilistic inferenceartificial intelligence,https://scholar.google.com/citations?hl=en&user=OtA9SwIAAAAJ
Laurent Dinh,Apple,https://scholar.google.com/citations?view_op=view_org&hl=en&org=11540454294127154050,Verified email at apple.com - Homepage,https://laurent-dinh.github.io/,12682,10750,24,22,28,25,Machine LearningDeep LearningUnsupervised LearningGenerative ModellingNormalizing Flows,https://scholar.google.com/citations?hl=en&user=h7OHSkoAAAAJ
Dinh C. Nguyen,"Assistant Professor, University of Alabama in Huntsville, USA",https://scholar.google.com/citations?view_op=view_org&hl=en&org=14188202466546394623,Verified email at uah.edu - Homepage,https://sites.google.com/view/dinh-chi-nguyen/home,6703,6695,28,28,36,36,Federated LearningBlockchainWireless NetworkingInternet of ThingsSecurity,https://scholar.google.com/citations?hl=en&user=XrVFic8AAAAJ
Quoc Tran-Dinh,"Department of Statistics and Operations Research, UNC",https://scholar.google.com/citations?view_op=view_org&hl=en&org=13300367165038667747,Verified email at email.unc.edu - Homepage,http://quoctd.web.unc.edu/,4127,2770,34,28,67,59,convex optimizationnonlinear programmingoptimization for machine learning,https://scholar.google.com/citations?hl=en&user=Wyxqvt8AAAAJ
Cuong Dinh,Bol.com; The Netherlands Cancer Institute,,Verified email at bol.com,,3325,3078,14,11,16,11,Computer VisionNatural Language ProcessingDeep Learning,https://scholar.google.com/citations?hl=en&user=6H8h5zAAAAAJ
Thi Kieu Khanh Ho,McGill University,https://scholar.google.com/citations?view_op=view_org&hl=en&org=13784427342582529234,Verified email at mcgill.ca,,450,449,10,10,11,11,Machine LearningDeep LearningAnomaly Detection,https://scholar.google.com/citations?hl=en&user=GKb618sAAAAJ
Jonathan Ho,Unknown affiliation,,Verified email at berkeley.edu - Homepage,http://www.jonathanho.me/,38429,37012,33,33,35,34,Artificial IntelligenceMachine Learning,https://scholar.google.com/citations?hl=en&user=iVLAQysAAAAJ
Hung T. Nguyen,"Professor of Mathematics, New Mexico State University",https://scholar.google.com/citations?view_op=view_org&hl=en&org=11761345890736700625,Verified email at math.nmsu.edu - Homepage,https://www.math.nmsu.edu/~hunguyen/,33260,12762,76,48,531,293,Applied Mathematics ·        Mathematical Statistics: Statistics of stochastic processesspatial statisticsstatistics of non,https://scholar.google.com/citations?hl=en&user=-LKhbM8AAAAJ
Tien N. Nguyen,"Professor, School of Engineering and Computer Science - The University of Texas at Dallas",https://scholar.google.com/citations?view_op=view_org&hl=en&org=6037664147916511730,Verified email at utdallas.edu - Homepage,http://www.utdallas.edu/~tien.n.nguyen/,13892,8231,60,47,197,131,AI4SESoftware EngineeringArtificial IntelligenceMining Software RepositoriesSoftware Mining,https://scholar.google.com/citations?hl=en&user=l4QhOVoAAAAJ
Huy V. Nguyen,Amazon,,Verified email at pitt.edu - Homepage,http://people.cs.pitt.edu/~huynv/,13234,4969,42,34,130,103,Natural Language Processing,https://scholar.google.com/citations?hl=en&user=KA3ZCe4AAAAJ
Nguyen H. Tran,The University of Sydney,https://scholar.google.com/citations?view_op=view_org&hl=en&org=17869855370174230969,Verified email at sydney.edu.au - Homepage,https://nguyenhoangtran.github.io/,11555,10409,51,48,151,131,Distributed compUtingoptimizAtionmachine Learning (DUAL),https://scholar.google.com/citations?hl=en&user=2QacQMgAAAAJ
Linh Nguyễn,Unknown affiliation,,Verified email at mit.edu,,9925,6585,45,40,202,147,ContructionArtificial IntelligenceConservation BiologyeconomicPricing Theory,https://scholar.google.com/citations?hl=en&user=k6MVfLYAAAAJ
Phan Minh Dung,"Professor, computer science, AIT",https://scholar.google.com/citations?view_op=view_org&hl=en&org=10896677993895577635,Verified email at cs.ait.ac.th,,10680,2952,28,15,49,20,artificial intelligence,https://scholar.google.com/citations?hl=en&user=FLpb_90AAAAJ
Le Thi Hoai An,university of Lorraine,https://scholar.google.com/citations?view_op=view_org&hl=en&org=1997201085834785197,Verified email at univ-lorraine.fr,,11370,5277,47,32,166,88,mathematical optimizationDC programming & DCAmachine learningoperations research,https://scholar.google.com/citations?hl=en&user=FMzNuMUAAAAJ
Chí Cao Minh,Stanford University,https://scholar.google.com/citations?view_op=view_org&hl=en&org=8539678734835078480,Verified email at alumni.stanford.edu,,3998,540,18,11,23,13,,https://scholar.google.com/citations?hl=en&user=VQwdv6IAAAAJ
Minh Do,"Senior Research Scientist, NASA ARC & KBR",,Verified email at nasa.gov,,3727,1400,30,19,64,33,Automated Planning Artificial Intelligence Scheduling,https://scholar.google.com/citations?hl=en&user=1A0lsR4AAAAJ
John Tran,NVIDIA,https://scholar.google.com/citations?view_op=view_org&hl=en&org=15729607608264555120,Verified email at nvidia.com,,11212,9005,14,10,15,11,,https://scholar.google.com/citations?hl=en&user=rHKT_jwAAAAJ
Richard Ngo,OpenAI,,Verified email at openai.com - Homepage,https://www.richardcngo.com/,3812,3809,7,7,6,6,Machine learning,https://scholar.google.com/citations?hl=en&user=7CY93A4AAAAJ
Ngô Bảo Châu,The University of Chicago,https://scholar.google.com/citations?view_op=view_org&hl=en&org=16671384941190438141,Verified email at uchicago.edu - Homepage,https://math.uchicago.edu/~ngo/,1574,668,20,14,26,15,Mathematics,https://scholar.google.com/citations?hl=en&user=J5i9pecAAAAJ
Hoan Thanh Ngo,"Assistant Professor of Computer Science and Engineering at Florida Southern College, Florida, USA",,Verified email at flsouthern.edu - Homepage,https://ngothanhhoan.wixsite.com/research/hoan,1438,995,18,18,23,23,AI in Medicine & Medical Diagnostics,https://scholar.google.com/citations?hl=en&user=niMq2ssAAAAJ
Tuan Vuong,"Centre for Sustainable Cyber Security (CS2), University of Greenwich",https://scholar.google.com/citations?view_op=view_org&hl=en&org=11483227425534905496,Verified email at gre.ac.uk,,806,674,9,8,9,8,Cyber-Physical SecurityMachine Learning,https://scholar.google.com/citations?hl=en&user=-S_skg4AAAAJ
Hailong Dao,University of Kansas,https://scholar.google.com/citations?view_op=view_org&hl=en&org=13272385838766914177,Verified email at ku.edu - Homepage,http://people.ku.edu/~hdao/,1356,877,22,16,38,29,Commutative AlgebraAlgebraic Geometry,https://scholar.google.com/citations?hl=en&user=dM5ZgaIAAAAJ
Nguyen Truong,"Assistant Professor, University of Glasgow",https://scholar.google.com/citations?view_op=view_org&hl=en&org=18074491010562968867,Verified email at glasgow.ac.uk - Homepage,https://nguyentb.github.io/,2086,1737,17,16,20,18,Blockchain Data Privacy Distributed System Decentralized System Internet of Things,https://scholar.google.com/citations?hl=en&user=mj4CTOgAAAAJ
Loc Vu-Quoc,illinois berkeley stanford florida civil mechanical aerospace engineering,,Verified email at illinois.edu - Homepage,http://bit.ly/17Wuww9,7929,1974,37,20,66,30,,https://scholar.google.com/citations?hl=en&user=xlH7V2QAAAAJ
Thang Vu,University of Stuttgart,https://scholar.google.com/citations?view_op=view_org&hl=en&org=10755262191494631905,Verified email at ims.uni-stuttgart.de - Homepage,http://www.ims.uni-stuttgart.de/institut/mitarbeiter/thangvu/index.en.html,5020,3600,38,31,102,90,SpeechNatural Language ProcessingMachine Learning,https://scholar.google.com/citations?hl=en&user=Nxbi5YgAAAAJ
Thanh Vu,Oracle Corporation,https://scholar.google.com/citations?view_op=view_org&hl=en&org=4070388776040915118,Verified email at oracle.com,,2800,2599,20,18,24,22,Natural Language ProcessingDeep LearningSearch Personalisation,https://scholar.google.com/citations?hl=en&user=EidMOuEAAAAJ
Tu Vu,"Research Scientist, Google DeepMind; Assistant Professor, Virginia Tech",https://scholar.google.com/citations?view_op=view_org&hl=en&org=6518679690484165796,Verified email at google.com - Homepage,https://tuvllms.github.io/,3141,3078,15,15,19,19,Natural Language ProcessingLarge Language ModelsTransfer Learning,https://scholar.google.com/citations?hl=en&user=tOevwEEAAAAJ
Tiep Vu,Google,https://scholar.google.com/citations?view_op=view_org&hl=en&org=6518679690484165796,Verified email at google.com,,2896,2596,9,9,9,9,Machine LearningDeep LearningComputer VisionConvex OptimizationRecommendation Systems,https://scholar.google.com/citations?hl=en&user=L8xkm3QAAAAJ
Quoc Dang Vu,University of Warwick,https://scholar.google.com/citations?view_op=view_org&hl=en&org=7480735251086199542,Verified email at warwick.ac.uk,,2816,2811,12,12,14,14,machine learningmedical imagingdigital pathology,https://scholar.google.com/citations?hl=en&user=qRPaefgAAAAJ
Tuan-Hung Vu,"Research scientist, valeo.ai",,Verified email at valeo.com - Homepage,http://tuanhungvu.github.io/,2810,2709,15,15,17,16,Computer VisionDeep LearningDomain AdaptationZero-shot LearningOpen-Vocabulary,https://scholar.google.com/citations?hl=en&user=QIHrPZQAAAAJ
Minh H. Vu,Postdoc researcher,,Verified email at umu.se,,2259,2222,10,10,10,10,machine learningimage processingmachine visionmedical imaging,https://scholar.google.com/citations?hl=en&user=6zWZDwYAAAAJ
Vu Kim Tuan,"Professor of Mathematics, Department of Computing and Mathematics, University of West Georgia",,No verified email - Homepage,https://www.westga.edu/profile.php?emp_id=474,2255,631,26,12,74,18,Mathematics,https://scholar.google.com/citations?hl=en&user=66Vr6dsAAAAJ
Vu Nguyen,Stony Brook University,https://scholar.google.com/citations?view_op=view_org&hl=en&org=6543801266527645443,Verified email at cs.stonybrook.edu,,1797,1646,13,12,16,13,Computer VisionMachine Learning,https://scholar.google.com/citations?hl=en&user=ushL-Y8AAAAJ
Vu Ngoc Pi,Ass. Prof. in Mechanical Engineering,,Verified email at tnut.edu.vn,,1779,1625,23,22,67,62,Mechanical EngineeringOptimum Design,https://scholar.google.com/citations?hl=en&user=dxW3zKgAAAAJ
Vu Nguyen,Amazon,,Verified email at robots.ox.ac.uk - Homepage,http://vu-nguyen.org/,1743,1552,24,22,38,30,Bayesian OptimisationMachine LearningAutoML,https://scholar.google.com/citations?hl=en&user=5RQyC9cAAAAJ
Phai Vu Dinh,"Ph.D. student, University of Technology Sydney",https://scholar.google.com/citations?view_op=view_org&hl=en&org=10906564628192137533,Verified email at student.uts.edu.au - Homepage,https://www.uts.edu.au/,1666,1603,7,7,5,4,Machine LearningRepresentation LearningCybersecurity.,https://scholar.google.com/citations?hl=en&user=VvxaCqUAAAAJ
Cuong Van Than,Axon,,Verified email at rice.edu,,1399,528,13,9,14,7,Computer ScienceMathematicsProgramming,https://scholar.google.com/citations?hl=en&user=b9SLRNMAAAAJ
Tong Zhang,UIUC,,Verified email at tongzhang-ml.org - Homepage,http://tongzhang-ml.org/,60433,35195,118,92,402,341,Machine Learning,https://scholar.google.com/citations?hl=en&user=LurWtuYAAAAJ
Allison Tong,The University of Sydney,https://scholar.google.com/citations?view_op=view_org&hl=en&org=17869855370174230969,Verified email at sydney.edu.au,,59835,47245,88,74,369,348,,https://scholar.google.com/citations?hl=en&user=fu9tTDoAAAAJ
