Name,Affiliation ,Affiliation Link,Email,Verified Email Link,Citations (Total),Citations (Since 2019),h-index (Total),h-index (Since 2019) ,i10-index (Total),i10-index (Since 2019) ,Interest ,Google Scholar Link
SonBinh Nguyen,"Professor of Chemistry, Northwestern University",https://scholar.google.com/citations?view_op=view_org&hl=en&org=2800120650280650005,Verified email at northwestern.edu - Homepage,http://chemgroups.northwestern.edu/nguyengroup/,105278,32094,105,59,298,201,organicpolymerinorganicmaterialscatalysis,https://scholar.google.com/citations?hl=en&user=0MWnxp4AAAAJ
Ngoc A. Nguyen,University of Illinois at Urbana-Champaign; Oak Ridge National Laboratory; University of Delaware,https://scholar.google.com/citations?view_op=view_org&hl=en&org=7738578430254982085,Verified email at ornl.gov - Homepage,https://appliedresearch.illinois.edu/,4239,3224,27,23,36,35,MaterialsPolymers,https://scholar.google.com/citations?hl=en&user=oO5UpbsAAAAJ
Nguyen Anh Chien,Nanyang Technological University,,Verified email at sg.bosch.com,,2373,1407,23,16,31,20,materialspolymersceramics,https://scholar.google.com/citations?hl=en&user=-132_rwAAAAJ
Minh Tho Nguyen,"KU Leuven, Belgium",https://scholar.google.com/citations?view_op=view_org&hl=en&org=8645310392855763529,Verified email at kuleuven.be,,34843,14008,76,49,764,385,Chemistry,https://scholar.google.com/citations?hl=en&user=AKkrECMAAAAJ
Vicky Doan-Nguyen Trigg,The Aerospace Corporation,https://scholar.google.com/citations?view_op=view_org&hl=en&org=6878756176784399299,Verified email at aero.org - Homepage,https://www.linkedin.com/in/vicky-doan-nguyen-trigg-ph-d-9b87457/,5237,2943,27,22,33,32,materials sciencechemistryenergy storage & conversionnanomaterialscatalysis,https://scholar.google.com/citations?hl=en&user=yNY79ooAAAAJ
H. Nguyen-Xuan,"CIRTech Institute, HUTECH University, Vietnam",,Verified email at hutech.edu.vn - Homepage,https://sites.google.com/site/nguyenxuanhungsite/,22024,14048,83,67,247,239,Computational EngineeringLarge-scale Data3D PrintingRenewable Energy,https://scholar.google.com/citations?hl=en&user=3iK9h-gAAAAJ
Le Yang,Lam Research,,Verified email at colostate.edu,,56034,51092,67,67,104,104,ALDThin Film DepositionPVDOptical CoatingsMaterials Science,https://scholar.google.com/citations?hl=en&user=sM1Hl_wAAAAJ
Huu Hao Ngo,"Distinguished Professor of Environmental Engineering, University of Technology, Sydney",https://scholar.google.com/citations?view_op=view_org&hl=en&org=10906564628192137533,Verified email at uts.edu.au,,57235,43788,114,99,643,561,Advanced biological waste treatment processesmembrane technologiesalternative water resourcesresource recoveryenvironmen,https://scholar.google.com/citations?hl=en&user=i199h4oAAAAJ
"Prof Tuan Ngo, FTSE","University of Melbourne, Research Program Leader - Building 4.0 CRC",https://scholar.google.com/citations?view_op=view_org&hl=en&org=10194437184893062620,Verified email at unimelb.edu.au - Homepage,http://www.findanexpert.unimelb.edu.au/display/person6717,29847,25761,80,74,268,239,Civil EngineeringStructural EngineeringPrefabricated Modular BuildingsExtreme Loadings,https://scholar.google.com/citations?hl=en&user=iAYdNsYAAAAJ
Minh Anh Phan Nguyen,"Postdoctoral Researcher, University of Technology Sydney",https://scholar.google.com/citations?view_op=view_org&hl=en&org=10906564628192137533,Verified email at student.uts.edu.au - Homepage,https://www.uts.edu.au/about/faculty-science/quantum-materials-and-nanophotonics/our-team,9007,3494,35,25,55,42,NanophotonicsQuantum OpticsSolid-State PhysicsMaterials Science,https://scholar.google.com/citations?hl=en&user=OiYbdHUAAAAJ
Vu Trieu Minh,"Professor of Mechatronics, Tallinn University of Technology",https://scholar.google.com/citations?view_op=view_org&hl=en&org=1537485348982639066,Verified email at ttu.ee - Homepage,https://www.etis.ee/Portal/Persons/Display/d4ce30a4-bf5c-436e-bc28-f3d9ead85315,1399,857,25,18,46,29,Model Predictive ControlAdvanced Control TechniquesAutomotive EngineeringMicrocontrollersArtificial Intelligence,https://scholar.google.com/citations?hl=en&user=FNUEiAkAAAAJ
Trieu Phat Luu,University of Houston,https://scholar.google.com/citations?view_op=view_org&hl=en&org=12223153883015729764,Verified email at central.uh.edu,,1342,1083,18,16,27,24,Brain Machine InterfaceMachine LearningNeuroscienceRehabilitation robotics,https://scholar.google.com/citations?hl=en&user=tHNc-NUAAAAJ
"Trieu Nguyen, PhD",Microfabrication Cleanroom Manager,,Verified email at honda-ri.com,,1186,1093,15,15,19,17,Micro-NanofluidicsSensorsPoint of care devicesLab on a Chip,https://scholar.google.com/citations?hl=en&user=SuHeFCAAAAAJ
Minh Tu PHAM,"Professor,  Mechanical Engineering Department, INSA Lyon, AMPERE, UMR CNRS 5005",https://scholar.google.com/citations?view_op=view_org&hl=en&org=5894927930181964761,Verified email at insa-lyon.fr - Homepage,https://cv.hal.science/minh-tu-pham,1859,787,24,16,53,23,ControlObserversIdentificationRobotics,https://scholar.google.com/citations?hl=en&user=3hNhP-0AAAAJ
Phạm Quang Cường,"Eureka Robotics, NTU Singapore",,Verified email at normalesup.org - Homepage,https://personal.ntu.edu.sg/cuong/,,,,,,,Robotics Control Theory 3D Printing,https://scholar.google.com/citations?hl=en&user=Cx9ayhIAAAAJ
Hieu Anh Doan,"Assistant Scientist, Argonne National Laboratory",https://scholar.google.com/citations?view_op=view_org&hl=en&org=5159551652619546637,Verified email at anl.gov - Homepage,http://hieuadoan.github.io/,1008,699,12,11,15,14,Heterogeneous CatalysisComputational ChemistryDensity Functional TheoryMaterials DiscoveryMachine Learning,https://scholar.google.com/citations?hl=en&user=nrsUdEoAAAAJ
"Nguyen Anh Khoa Doan, Ph.D.",Delft University of Technology,https://scholar.google.com/citations?view_op=view_org&hl=en&org=814705155794667179,Verified email at tudelft.nl - Homepage,https://www.tudelft.nl/staff/n.a.k.doan/,835,809,18,18,26,26,TurbulenceFluid DynamicsCombustionTurbulent Reacting FlowsMachine Learning,https://scholar.google.com/citations?hl=en&user=0d-oykQAAAAJ
Anh-Dzung Doan,Australian Institute for Machine Learning,,Verified email at adelaide.edu.au - Homepage,https://dzungdoan6.github.io/,490,399,10,10,10,10,Robotic VisionComputer VisionMachine LearningRobotics,https://scholar.google.com/citations?hl=en&user=Ch9rZ_kAAAAJ
The Nam Long Doan,"Trusscore Inc., University of Waterloo",https://scholar.google.com/citations?view_op=view_org&hl=en&org=12436753108180256887,Verified email at uwaterloo.ca - Homepage,https://trusscore.com/corporate/research-and-development-team.html,2417,1430,25,18,29,25,rechargeable batteriesconductive plasticsnanotechnologyCNT dispersion,https://scholar.google.com/citations?hl=en&user=F09RPIUAAAAJ
Tinh Quoc Bui,"Director of DTRICE-HCM, DTU; Associate Professor, Tokyo Institute of Technology",https://scholar.google.com/citations?view_op=view_org&hl=en&org=4801346853009234900,Verified email at m.titech.ac.jp - Homepage,https://sites.google.com/site/tinhqbui/,13031,9848,68,57,218,212,computational mechanicsmaterial failurecompositessolid mechanics,https://scholar.google.com/citations?hl=en&user=arV1Pk8AAAAJ
Ngoc Bui,"The University of Oklahoma (OU), Berkeley Lab, Livermore Lab, UConn",,Verified email at lbl.gov - Homepage,https://www.thebuilab.com/,3358,1782,20,18,22,20,Energy-Water-Environment NexusSeparation ScienceNanomaterialsMembrane ScienceTransport Phenomena,https://scholar.google.com/citations?hl=en&user=-9ArTS8AAAAJ
Bui Van-Hai,"Assistant Professor, Electrical and Computer Engineering at University of Michigan-Dearborn",https://scholar.google.com/citations?view_op=view_org&hl=en&org=4770128543809686866,Verified email at umich.edu - Homepage,http://buivanhaibk.wixsite.com/van-haibui,2839,2576,23,22,34,32,Electrical EngineeringMicrogridRenewable Energy SourcesReinforcement LearningEnergy Management System,https://scholar.google.com/citations?hl=en&user=OckjbHUAAAAJ
Francis Minhthang Bui,"Associate Professor, ECE Department, University of Saskatchewan",https://scholar.google.com/citations?view_op=view_org&hl=en&org=7846091072518378427,Verified email at usask.ca - Homepage,"https://engineering.usask.ca/people/ece/bui,francis.php",2619,1840,24,20,55,42,Signal ProcessingMachine LearningCommunicationsBiomedical Engineering,https://scholar.google.com/citations?hl=en&user=-N2mIdwAAAAJ
Ba-Ngu Vo,Curtin University,https://scholar.google.com/citations?view_op=view_org&hl=en&org=12204274328548754159,Verified email at curtin.edu.au - Homepage,http://ba-ngu.vo-au.com/index.html,25447,10861,71,46,161,102,statistical signal processingstochastic geometryrandom setspoint processtarget tracking,https://scholar.google.com/citations?hl=en&user=V03zTGIAAAAJ
Thuc Vo,La Trobe University,https://scholar.google.com/citations?view_op=view_org&hl=en&org=6055244364183599709,Verified email at latrobe.edu.au,,9059,6375,54,45,110,101,Structural engineeringMechanical engineering,https://scholar.google.com/citations?hl=en&user=1NE_wEoAAAAJ
K.T. Chau,The Hong Kong Polytechnic University,https://scholar.google.com/citations?view_op=view_org&hl=en&org=10969585421171712084,Verified email at polyu.edu.hk,,28736,11751,84,50,362,227,Electric vehicle technologiesRenewable energy systemsMachines and drivesPower electronics,https://scholar.google.com/citations?hl=en&user=5wptXfQAAAAJ
Cao-Thang Dinh,"Assistant Professor, Queen's University",https://scholar.google.com/citations?view_op=view_org&hl=en&org=15288470216663349706,Verified email at queensu.ca - Homepage,https://refuelqueens.com/,30071,27413,67,61,98,95,Renewable fuels and chemicalsCO2 conversionelectrochemical systemscatalysis,https://scholar.google.com/citations?hl=en&user=SpJXjD4AAAAJ
Truong X. Nghiem,University of Central Florida,https://scholar.google.com/citations?view_op=view_org&hl=en&org=655088595194328060,Verified email at ucf.edu - Homepage,http://nxtlab.org/,1393,706,19,12,32,17,intelligent cyber-physical systemsML/AI and controlautonomous systemsrobotics,https://scholar.google.com/citations?hl=en&user=ELMp9FMAAAAJ
Mai Thang Long,Industrial University of Ho Chi Minh City,,Verified email at iuh.edu.vn,,283,166,10,9,10,6,Robotics ControlLearning ControlIntelligent Control,https://scholar.google.com/citations?hl=en&user=_SWoD0cAAAAJ
Le Thai Duy,Ajou University,https://scholar.google.com/citations?view_op=view_org&hl=en&org=8057873644277280226,Verified email at ajou.ac.kr,,2394,1984,22,21,33,33,SensingEnergyNanomaterialsWearable electronicsSelf-healing,https://scholar.google.com/citations?hl=en&user=kiyITEYAAAAJ
Chi Thai,"Associate Professor, College of Engineering, University of Georgia",https://scholar.google.com/citations?view_op=view_org&hl=en&org=14091600928394989845,Verified email at engr.uga.edu - Homepage,http://www.engr.uga.edu/mvteachr,1871,659,21,10,37,12,Spectral Machine VisionTheatre RoboticsSystems Modeling & SimulationInstructional Technologies,https://scholar.google.com/citations?hl=en&user=TOIC0FoAAAAJ
Dinh Thai Hoang,"University of Technology Sydney (UTS), Australia",https://scholar.google.com/citations?view_op=view_org&hl=en&org=10906564628192137533,Verified email at uts.edu.au - Homepage,https://sites.google.com/view/dinh-thai-hoang/,17680,14701,48,47,121,117,Mobile Edge ComputingApplied AIIntelligent CommunicationsMetaverseCyberattack Detection,https://scholar.google.com/citations?hl=en&user=-esKZ8YAAAAJ
Minh Kieu,University of Auckland,https://scholar.google.com/citations?view_op=view_org&hl=en&org=6458948531608421033,Verified email at auckland.ac.nz - Homepage,https://leminhkieu.github.io/,1571,1200,20,15,28,24,Urban AnalyticsIntelligent Transport SystemsAgent-Based Modelling,https://scholar.google.com/citations?hl=en&user=mjpqmUsAAAAJ
Professor Hoa Le Minh,"Northumbria University, United Kingdom",https://scholar.google.com/citations?view_op=view_org&hl=en&org=12953674542438929004,Verified email at northumbria.ac.uk - Homepage,https://www.northumbria.ac.uk/about-us/our-staff/l/hoa-le-minh/,8954,4071,41,31,107,73,Optical communicationsMobile CommunicationsSmartphone TechnologySignal Processing,https://scholar.google.com/citations?hl=en&user=8Khn9ckAAAAJ
Hieu Trinh,"Professor, School of Engineering, Deakin University, Australia",https://scholar.google.com/citations?view_op=view_org&hl=en&org=10412436667236230217,Verified email at deakin.edu.au - Homepage,https://orcid.org/0000-0003-3438-9969,8396,4553,49,34,195,143,controlfunctional observersreachable setpositive systemsinterconnected systems,https://scholar.google.com/citations?hl=en&user=3oghCzEAAAAJ
Phuong H. Nguyen,Eindhoven University of Technology,https://scholar.google.com/citations?view_op=view_org&hl=en&org=6095389282517722295,Verified email at tue.nl - Homepage,https://www.tue.nl/en/research/researchers/phuong-nguyen/,7015,5312,39,32,117,92,Electric Power Systems Smart Grids Active Distribution Networks Microgrids Digitalization,https://scholar.google.com/citations?hl=en&user=6YrrpGwAAAAJ
Quang Ha,University of Technology Sydney,https://scholar.google.com/citations?view_op=view_org&hl=en&org=10906564628192137533,Verified email at uts.edu.au,,7824,2946,42,28,137,67,Automation Engineering,https://scholar.google.com/citations?hl=en&user=cKyQqDkAAAAJ
Giang T. Nguyen,Assistant Professor | CeTI – Cluster of Excellence | ceti.one,,Verified email at tu-dresden.de - Homepage,https://tu-dresden.de/ing/elektrotechnik/ifn/hcs/die-professur/inhaber-in,1066,1018,17,17,35,35,In-Network Computing Network Softwarization Distributed Systems,https://scholar.google.com/citations?hl=en&user=U1fIVqcAAAAJ
Khiem Vuong,"PhD Candidate, Robotics Institute, Carnegie Mellon University",https://scholar.google.com/citations?view_op=view_org&hl=en&org=17554517495610703090,Verified email at andrew.cmu.edu - Homepage,https://www.khiemvuong.com/,102,102,4,4,3,3,Computer VisionRobotics,https://scholar.google.com/citations?hl=en&user=ircIPFsAAAAJ
Nghia Vuong,"PhD Student, Nanyang Technological University",https://scholar.google.com/citations?view_op=view_org&hl=en&org=3012140508424117850,Verified email at e.ntu.edu.sg,,29,29,1,1,1,1,roboticsreinforcement learning,https://scholar.google.com/citations?hl=en&user=8V1ECoQAAAAJ
Tung Nguyen,Associate Professor,,No verified email,,13257,8347,55,42,206,155,3D Imaging,https://scholar.google.com/citations?hl=en&user=0WT-jwYAAAAJ
Quoc P. Nguyen,"Professor, University of Texas at Austin",https://scholar.google.com/citations?view_op=view_org&hl=en&org=14823011757688503605,Verified email at mail.utexas.edu,,9798,5421,52,39,155,135,Interface & Colloid ScienceGeosystems EngineeringEnhanced Oil RecoveryCarbon Utilization & Storage,https://scholar.google.com/citations?hl=en&user=l0IDbJAAAAAJ
Duy T. Ngo,"Associate Professor, The University of Newcastle, Australia",https://scholar.google.com/citations?view_op=view_org&hl=en&org=13721485061121641907,Verified email at newcastle.edu.au - Homepage,http://www.newcastle.edu.au/profile/duy-ngo,3068,1740,29,21,55,39,Edge intelligenceIoT communicationsapplied machine learning5G/6Gintelligent transportation systems,https://scholar.google.com/citations?hl=en&user=SQyL0ZgAAAAJ
Le Xie,"Gordon McKay Professor of Electrical Engineering, Harvard University",https://scholar.google.com/citations?view_op=view_org&hl=en&org=1896398670060433590,Verified email at seas.harvard.edu - Homepage,https://seas.harvard.edu/person/le-xie,12253,6993,54,42,174,146,Power Systems EconomicsData SciencesPublic PolicyArtificial Intelligence,https://scholar.google.com/citations?hl=en&user=e7qebm4AAAAJ
Tuan T. Tran,Oregon State University,,No verified email,,8395,4880,44,35,123,79,Wireless communications cloud computing distributed systems,https://scholar.google.com/citations?hl=en&user=2fAYSlkAAAAJ
Anh T. Ngo,"Associate Professor, University of Illinois Chicago, Physicsist at Argonne National Labs",https://scholar.google.com/citations?view_op=view_org&hl=en&org=5159551652619546637,Verified email at anl.gov,,2888,2636,28,27,38,37,Multiscale Materials ModelingCorrelated Quantum modelsRenewable EnergyBattery materials,https://scholar.google.com/citations?hl=en&user=OyMno5QAAAAJ
Ngo Anh Vien,Bosch Center for Artificial Intelligence (BCAI),,Verified email at bosch.com - Homepage,https://vienngo.github.io/,1511,1051,21,17,38,26,machine learningrobotics,https://scholar.google.com/citations?hl=en&user=xk1gsM8AAAAJ
Son V.T. Dao,Ritsumeikan University,https://scholar.google.com/citations?view_op=view_org&hl=en&org=6426660345193054045,Verified email at fc.ritsumei.ac.jp - Homepage,https://www.researchgate.net/profile/Son_Dao,1814,1229,17,15,25,20,Image sensor designUltra high speed imagingHigh Performance ImagingArtificial IntelligenceOptimization,https://scholar.google.com/citations?hl=en&user=sDWiatgAAAAJ
Danh Le Phuoc,Group Leader and Principle Investigator at Technical University of Berlin,https://scholar.google.com/citations?view_op=view_org&hl=en&org=15309337599806254000,Verified email at tu-berlin.de - Homepage,https://danhlephuoc.info/,6175,3125,30,19,49,34,Semantic Stream Processing and ReasoninSemantic Sensor Network/MiddlewareMobile DatabaseSemantic MashupEmbedded System/I,https://scholar.google.com/citations?hl=en&user=7-k4HCoAAAAJ
Thanh Long Vu,"MIT, PNNL",https://scholar.google.com/citations?view_op=view_org&hl=en&org=16345133980181568013,Verified email at mit.edu,,999,716,16,14,23,18,power systemscontrol systemsreinforcement learningmicrogrids,https://scholar.google.com/citations?hl=en&user=ilDS2e4AAAAJ
Chi-Thanh Vu,Hawkins-Weir Engineers,,Verified email at hawkins-weir.com,,1818,1756,24,24,37,36,Environmental engineering,https://scholar.google.com/citations?hl=en&user=o57naogAAAAJ
Bang Cong Vu,"3NLab,  BeRC, Leuven, Belgium",,Verified email at qplox.com,,1792,1097,17,16,20,17,optimizaton,https://scholar.google.com/citations?hl=en&user=zf7yzUQAAAAJ
Thein Than Tun,"Research Associate, The Open University",https://scholar.google.com/citations?view_op=view_org&hl=en&org=222627211422878279,Verified email at open.ac.uk - Homepage,http://mcs.open.ac.uk/ttt23/,1438,704,24,15,41,22,Requirements EngineeringSecurityAdaptationDigital ForensicsSystem Failures,https://scholar.google.com/citations?hl=en&user=Sg6iTHsAAAAJ
Hieu Hoang,Microsoft,https://scholar.google.com/citations?view_op=view_org&hl=en&org=12331530069074480064,Verified email at microsoft.com - Homepage,http://statmt.org/hieu/,10334,3786,23,13,29,16,Machine Translation,https://scholar.google.com/citations?hl=en&user=j1CxU9wAAAAJ
Anh Tuan Hoang,"Institute for Infocomm Research, Singapore",,Verified email at i2r.a-star.edu.sg,,7183,1186,26,11,38,12,Intelligent Transport SystemsSmart GridWireless Communication & Networking,https://scholar.google.com/citations?hl=en&user=8hdJ778AAAAJ
"Tien Dat Pham,  MSc and PhD","Macquarie University Research Fellow (MQRF), School of Natural Sciences, Sydney, Australia",https://scholar.google.com/citations?view_op=view_org&hl=en&org=15211955218694959468,Verified email at mq.edu.au - Homepage,https://sites.google.com/view/tiendatpham/home,3458,3299,29,28,42,40,Remote SensingBlue CarbonMangrovesMachine LearningEcosystem Services,https://scholar.google.com/citations?hl=en&user=i9sIr3YAAAAJ
Thinh T. Doan,"Assistant Professor, University of Texas Austin",,Verified email at vt.edu - Homepage,https://sites.google.com/site/thinhdoan210,1323,1257,21,21,33,32,Control TheoryOptimizationStochastic ApproximationReinforcement LearningMulti-Agent Systems,https://scholar.google.com/citations?hl=en&user=FiN_HnEAAAAJ
Thai Doan Chuong,"Lecturer of Mathematics, Brunel University London",https://scholar.google.com/citations?view_op=view_org&hl=en&org=14480557975201879779,Verified email at brunel.ac.uk - Homepage,https://sites.google.com/site/thaidoanchuong/,1322,862,22,15,43,30,OptimizationOperational Research,https://scholar.google.com/citations?hl=en&user=94ToTtcAAAAJ
Prof. Ana Jones (Prof. Anh N. Phan),"Professor, Newcastle University",https://scholar.google.com/citations?view_op=view_org&hl=en&org=7687019144636890226,Verified email at ncl.ac.uk - Homepage,https://www.ncl.ac.uk/engineering/staff/profile/anhphan.html#background,5868,4249,39,34,70,69,process intensification/reactor engineeringbiofuel processingadvanced thermochemical processescircularitysustainability,https://scholar.google.com/citations?hl=en&user=0Whd4kQAAAAJ
Hien Quoc Ngo,"Reader, Queen's University Belfast, UK",https://scholar.google.com/citations?view_op=view_org&hl=en&org=2175268696339219833,Verified email at qub.ac.uk - Homepage,https://sites.google.com/site/nqhienqn/,20060,14810,51,46,120,110,Wireless CommunicationCommunication TheoryMassive MIMOCell-Free Massive MIMO5G and Beyond,https://scholar.google.com/citations?hl=en&user=DbMdragAAAAJ
Quoc-Tuan Tran,Professor & Director of Research,,Verified email at cea.fr - Homepage,http://www.ines-solaire.org/,2269,1462,25,19,82,49,Electrical engineering,https://scholar.google.com/citations?hl=en&user=vPIameAAAAAJ
Quoc Bao Vo,"Associate Professor of Artificial Intelligence, Swinburne University of Technology",https://scholar.google.com/citations?view_op=view_org&hl=en&org=15675974578668555345,Verified email at swin.edu.au,,1988,886,21,13,56,23,artificial intelligence multi agent systems intelligent autonomous agents automated negotiation,https://scholar.google.com/citations?hl=en&user=Gf-kzyEAAAAJ
Thao Dang,University of Applied Sciences Esslingen,,Verified email at hs-esslingen.de,,3634,1769,22,13,29,14,Self Driving CarsAutonomous Systems,https://scholar.google.com/citations?hl=en&user=MzVfUCQAAAAJ
Dũng (Dzung) Dinh Luong,"Industry Assistant Professor, New York University",https://scholar.google.com/citations?view_op=view_org&hl=en&org=17630047345716507964,Verified email at nyu.edu - Homepage,http://engineering.nyu.edu/people/dzung-dinh-luong,1177,635,14,13,17,15,Mechanical EngineeringMaterial EngineeringMaterial Characterization,https://scholar.google.com/citations?hl=en&user=E70YzQEAAAAJ
Vinh Phu Nguyen,Monash University,https://scholar.google.com/citations?view_op=view_org&hl=en&org=3918598370877205258,Verified email at monash.edu - Homepage,http://nvinhphu.wixsite.com/mysite,8757,6059,42,40,71,66,Computational mechanicsphase-field fracture modelisogeometric analysismultiscale fracturematerial point method,https://scholar.google.com/citations?hl=en&user=jCqqCAoAAAAJ
Thinh Nguyen,Oregon State University,https://scholar.google.com/citations?view_op=view_org&hl=en&org=4076333604111023687,Verified email at eecs.oregonstate.edu - Homepage,http://www.eecs.oregonstate.edu/~thinhq,6529,2826,37,24,118,62,Probabilitysignal processingwireless communicationnetworkingdistributed systems,https://scholar.google.com/citations?hl=en&user=9flSED8AAAAJ
Thinh Quang Dinh,TBA,,Verified email at ieee.org - Homepage,https://thinhqdinh.github.io/,1591,1498,9,9,8,8,Quantum ComputingOptimizationEdge ComputingMachine Learning,https://scholar.google.com/citations?hl=en&user=g54O0ekAAAAJ
"Nguyen, Truong Thinh","Associate Professor, Institute of Intelligent and Interactive Technologies, University of Economics",,Verified email at ueh.edu.vn - Homepage,http://www.ueh.edu.vn/,1478,1148,19,15,45,34,RoboticsAIMechatronicsIntelligent ControlAutomation,https://scholar.google.com/citations?hl=en&user=kh9KljsAAAAJ
Binh Nguyen,Amazon Web Services,,Verified email at cs.utah.edu - Homepage,http://binhqnguyen.github.io/,5718,5341,14,14,23,21,Mobile networkingSoftware-defined NetworkingDistributed Systems,https://scholar.google.com/citations?hl=en&user=gmm52VkAAAAJ
Song Han,"Associate Professor, School of Computing, University of Connecticut",https://scholar.google.com/citations?view_op=view_org&hl=en&org=4789175759683815312,Verified email at uconn.edu - Homepage,http://cps.cse.uconn.edu/,7066,4853,32,24,93,59,Industrial Internet-of-ThingsCyber-Physical SystemsReal-Time and Embedded SystemsWireless,https://scholar.google.com/citations?hl=en&user=nO2uJ4YAAAAJ
Nhat (Nick) Pham,"Lecturer (Assistant Professor), Cardiff University",https://scholar.google.com/citations?view_op=view_org&hl=en&org=9175319048828668389,Verified email at cardiff.ac.uk - Homepage,https://www.agilecps.org/team/nick,321,307,9,9,8,8,Cyper-Physical SystemsEmbedded SystemsWireless Sensor NetworksCognitive Radio Networks,https://scholar.google.com/citations?hl=en&user=pkmiZ2cAAAAJ
Phan Tu Vuong,"Associate Professor, University of Southampton, UK",https://scholar.google.com/citations?view_op=view_org&hl=en&org=1346287526782559840,Verified email at soton.ac.uk - Homepage,https://www.southampton.ac.uk/maths/about/staff/tvp1e19.page#research,2731,2560,22,22,30,29,OptimizationVariational Analysis,https://scholar.google.com/citations?hl=en&user=drqMpZgAAAAJ
Trung Phan Van,"PhD Fellow, Technische Universität Chemnitz, Germany",https://scholar.google.com/citations?view_op=view_org&hl=en&org=16083856593407011348,Verified email at etit.tu-chemnitz.de - Homepage,https://sites.google.com/site/pvtrung92/home,1120,1066,17,17,22,22,Deep Reinforcement LearningTransfer LearningFederated LearningSoftware-Defined Internet of ThingsIntrusion Response,https://scholar.google.com/citations?hl=en&user=vt3f1rEVFvAC
Diep N. Nguyen,University of Technology Sydney,https://scholar.google.com/citations?view_op=view_org&hl=en&org=10906564628192137533,Verified email at uts.edu.au - Homepage,https://sites.google.com/view/diep-n-nguyen/,5008,4652,39,36,90,85,Mobile ComputingCommunications and NetworkingWireless and Cyber Security5G/6GApplied AI,https://scholar.google.com/citations?hl=en&user=d9jZ1yIAAAAJ
Professor Vu Ngoc Phat,Unknown affiliation,,Verified email at math.ac.vn,,3442,1094,32,17,95,36,Control  & Systems theoryOptimizationMath AnalysisTime-delay systems .,https://scholar.google.com/citations?hl=en&user=Ts2rSO8AAAAJ
