Name,Title,Email,Address,Phone Number
Alexandra P Dang,College Relations,alexandradang@berkeley.edu,,
Dangsong Namgyal,Engineering Research Centers,dnamgyal@berkeley.edu,,
Clark Tu-Cuong Nguyen,"Professor, Elect Eng Div Operations",ctnguyen@eecs.berkeley.edu,"574 Cory Hall Berkeley, CA 94720",+1 510-642-6251
Emily Thanh Nguyen,"Executive Assistant, Col of Engin Dean's Office",emilythanh@berkeley.edu,"320 McLaughlin Hall Berkeley, CA 94720-1700",+1 510-642-5771
Jean Nguyen,COENG Eng Student Services,jeannguyen@berkeley.edu,,
Khanh Nguyen,Elect Eng Div Operations,kxnguyen@berkeley.edu,,
Jessica Ly Pham,Earthquake Engin Res Ctr,jessicapham@berkeley.edu,,
Jasmina L Vujic,"Professor, Nuclear Engineering",vujic@nuc.berkeley.edu,"4105 Etcheverry Berkeley, CA 94720",+1 510-643-8085
Dat Le,"Assistant Dean, Col of Engin Dean's Office",dat@berkeley.edu,"320 McLaughlin Hall Berkeley, CA 94720",+1 510-642-7655
